{
  "$schema": "./schema.json",
  "version": 1,
  "id": "catppuccin-latte",
  "name": "Catppuccin Latte",
  "family": "catppuccin",
  "familyName": "Catppuccin",
  "flavor": "Latte",
  "isDark": false,
  "background": "#eff1f5",
  "surface": "#e6e9ef",
  "surfaceAlt": "#dce0e8",
  "border": "#ccd0da",
  "text": "#4c4f69",
  "muted": "#6c6f85",
  "accent": "#8839ef",
  "ansi": [
    "#4c4f69",
    "#d20f39",
    "#40a02b",
    "#df8e1d",
    "#1e66f5",
    "#ea76cb",
    "#04a5e5",
    "#6c6f85",
    "#ccd0da",
    "#d20f39",
    "#40a02b",
    "#df8e1d",
    "#1e66f5",
    "#ea76cb",
    "#04a5e5",
    "#4c4f69"
  ],
  "working": "#40a02b",
  "waiting": "#fe640b",
  "failed": "#d20f39",
  "scene": {
    "top": "#f8f9fb",
    "bottom": "#d2d6e0",
    "glow": "#fbfcfd",
    "plate": "#b5b9c6",
    "grid": "#9296a7",
    "edge": "#414359",
    "xray": "#7042b9"
  }
}
