{
  "$schema": "./schema.json",
  "version": 1,
  "id": "nord-light",
  "name": "Nord light",
  "family": "nord",
  "familyName": "Nord",
  "isDark": false,
  "background": "#eceff4",
  "surface": "#e5e9f0",
  "surfaceAlt": "#d8dee9",
  "border": "#c2cad8",
  "text": "#2e3440",
  "muted": "#4c566a",
  "accent": "#5e81ac",
  "selection": "#d8dee9",
  "ansi": [
    "#2e3440",
    "#bf616a",
    "#a3be8c",
    "#ebcb8b",
    "#5e81ac",
    "#b48ead",
    "#8fbcbb",
    "#4c566a",
    "#c2cad8",
    "#bf616a",
    "#a3be8c",
    "#ebcb8b",
    "#5e81ac",
    "#b48ead",
    "#8fbcbb",
    "#2e3440"
  ],
  "working": "#a3be8c",
  "waiting": "#d08770",
  "failed": "#bf616a",
  "scene": {
    "top": "#f6f8fa",
    "bottom": "#cbd2df",
    "glow": "#fafbfc",
    "plate": "#a7afbd",
    "grid": "#7f8794",
    "edge": "#272c36",
    "xray": "#4b6281"
  }
}
