{
  "$schema": "./schema.json",
  "version": 1,
  "id": "pixyll",
  "name": "Pixyll",
  "family": "pixyll",
  "familyName": "Pixyll",
  "isDark": false,
  "background": "#ffffff",
  "surface": "#f7f7f8",
  "surfaceAlt": "#efeff1",
  "border": "#e0e0e3",
  "text": "#333333",
  "muted": "#7a7a7a",
  "accent": "#428bca",
  "ansi": [
    "#333333",
    "#c0392b",
    "#2e7d32",
    "#8a6d00",
    "#2a6fb0",
    "#8b3f86",
    "#1b7a8a",
    "#7a7a7a",
    "#e0e0e3",
    "#c0392b",
    "#2e7d32",
    "#8a6d00",
    "#2a6fb0",
    "#8b3f86",
    "#1b7a8a",
    "#333333"
  ],
  "working": "#2e7d32",
  "waiting": "#b35a14",
  "failed": "#c0392b",
  "scene": {
    "top": "#ffffff",
    "bottom": "#e6e6e9",
    "glow": "#ffffff",
    "plate": "#c1c1c3",
    "grid": "#929294",
    "edge": "#2b2b2b",
    "xray": "#3c688e"
  }
}
