{
  "$schema": "./schema.json",
  "version": 1,
  "id": "newsprint-dark",
  "name": "Newsprint dark",
  "family": "newsprint",
  "familyName": "Newsprint",
  "isDark": true,
  "background": "#1b1a17",
  "surface": "#262420",
  "surfaceAlt": "#2d2b26",
  "border": "#403d36",
  "text": "#ece7dc",
  "muted": "#9a9488",
  "accent": "#6fb0dc",
  "ansi": [
    "#262420",
    "#e8776d",
    "#8fbf7a",
    "#d9b866",
    "#6fb0dc",
    "#d88ab5",
    "#6cc0c4",
    "#9a9488",
    "#403d36",
    "#e8776d",
    "#8fbf7a",
    "#d9b866",
    "#6fb0dc",
    "#d88ab5",
    "#6cc0c4",
    "#ece7dc"
  ],
  "working": "#8fbf7a",
  "waiting": "#e39b5b",
  "failed": "#e8776d",
  "scene": {
    "top": "#262420",
    "bottom": "#161512",
    "glow": "#36332d",
    "plate": "#36332d",
    "grid": "#b8b3a7",
    "edge": "#0f0e0d"
  }
}
