{
  "$schema": "./schema.json",
  "version": 1,
  "id": "catppuccin-frappe",
  "name": "Catppuccin Frappe",
  "family": "catppuccin",
  "familyName": "Catppuccin",
  "flavor": "Frappe",
  "isDark": true,
  "background": "#303446",
  "surface": "#414559",
  "surfaceAlt": "#494d63",
  "border": "#51576d",
  "text": "#c6d0f5",
  "muted": "#838ba7",
  "accent": "#ca9ee6",
  "ansi": [
    "#292c3c",
    "#e78284",
    "#a6d189",
    "#e5c890",
    "#8caaee",
    "#f4b8e4",
    "#99d1db",
    "#838ba7",
    "#51576d",
    "#e78284",
    "#a6d189",
    "#e5c890",
    "#8caaee",
    "#f4b8e4",
    "#99d1db",
    "#c6d0f5"
  ],
  "working": "#a6d189",
  "waiting": "#ef9f76",
  "failed": "#e78284",
  "scene": {
    "top": "#414559",
    "bottom": "#262a38",
    "glow": "#4b5065",
    "plate": "#4b5065",
    "grid": "#a9b2d3",
    "edge": "#1a1d27"
  }
}
