{
  "$schema": "./schema.json",
  "version": 1,
  "id": "catppuccin-macchiato",
  "name": "Catppuccin Macchiato",
  "family": "catppuccin",
  "familyName": "Catppuccin",
  "flavor": "Macchiato",
  "isDark": true,
  "background": "#24273a",
  "surface": "#363a4f",
  "surfaceAlt": "#404459",
  "border": "#494d64",
  "text": "#cad3f5",
  "muted": "#8087a2",
  "accent": "#c6a0f6",
  "ansi": [
    "#1e2030",
    "#ed8796",
    "#a6da95",
    "#eed49f",
    "#8aadf4",
    "#f5bde6",
    "#91d7e3",
    "#8087a2",
    "#494d64",
    "#ed8796",
    "#a6da95",
    "#eed49f",
    "#8aadf4",
    "#f5bde6",
    "#91d7e3",
    "#cad3f5"
  ],
  "working": "#a6da95",
  "waiting": "#f5a97f",
  "failed": "#ed8796",
  "scene": {
    "top": "#363a4f",
    "bottom": "#1d1f2e",
    "glow": "#41455c",
    "plate": "#41455c",
    "grid": "#9da5c4",
    "edge": "#141520"
  }
}
