{
  "$schema": "./schema.json",
  "version": 1,
  "id": "dracula",
  "name": "Dracula",
  "family": "dracula",
  "familyName": "Dracula",
  "isDark": true,
  "background": "#282a36",
  "surface": "#21222c",
  "surfaceAlt": "#343746",
  "border": "#44475a",
  "text": "#f8f8f2",
  "muted": "#6272a4",
  "accent": "#bd93f9",
  "selection": "#44475a",
  "ansi": [
    "#21222c",
    "#ff5555",
    "#50fa7b",
    "#f1fa8c",
    "#8be9fd",
    "#ff79c6",
    "#8be9fd",
    "#6272a4",
    "#44475a",
    "#ff5555",
    "#50fa7b",
    "#f1fa8c",
    "#8be9fd",
    "#ff79c6",
    "#8be9fd",
    "#f8f8f2"
  ],
  "working": "#50fa7b",
  "waiting": "#ffb86c",
  "failed": "#ff5555",
  "scene": {
    "top": "#21222c",
    "bottom": "#20222b",
    "glow": "#363848",
    "plate": "#363848",
    "grid": "#9aa4c1",
    "edge": "#16171e"
  }
}
