{
  "$schema": "./schema.json",
  "version": 1,
  "id": "newsprint",
  "name": "Newsprint",
  "family": "newsprint",
  "familyName": "Newsprint",
  "isDark": false,
  "background": "#f3f2ee",
  "surface": "#eceae4",
  "surfaceAlt": "#e4e2da",
  "border": "#c5c5c5",
  "text": "#1f0909",
  "muted": "#6f6a66",
  "accent": "#065588",
  "ansi": [
    "#1f0909",
    "#a3271f",
    "#2f6b2a",
    "#7a5c00",
    "#065588",
    "#8a2a5e",
    "#0f6a72",
    "#6f6a66",
    "#c5c5c5",
    "#a3271f",
    "#2f6b2a",
    "#7a5c00",
    "#065588",
    "#8a2a5e",
    "#0f6a72",
    "#1f0909"
  ],
  "working": "#2f6b2a",
  "waiting": "#a24f12",
  "failed": "#a3271f",
  "scene": {
    "top": "#faf9f7",
    "bottom": "#d1d1cd",
    "glow": "#fcfcfb",
    "plate": "#a7a3a3",
    "grid": "#7a7070",
    "edge": "#1a0808",
    "xray": "#103755"
  }
}
