{
  "$schema": "./schema.json",
  "version": 1,
  "id": "nord",
  "name": "Nord",
  "family": "nord",
  "familyName": "Nord",
  "isDark": true,
  "background": "#2e3440",
  "surface": "#3b4252",
  "surfaceAlt": "#434c5e",
  "border": "#4c566a",
  "text": "#eceff4",
  "muted": "#8892a6",
  "accent": "#88c0d0",
  "selection": "#434c5e",
  "ansi": [
    "#3b4252",
    "#bf616a",
    "#a3be8c",
    "#ebcb8b",
    "#81a1c1",
    "#b48ead",
    "#8fbcbb",
    "#8892a6",
    "#4c566a",
    "#bf616a",
    "#a3be8c",
    "#ebcb8b",
    "#81a1c1",
    "#b48ead",
    "#8fbcbb",
    "#eceff4"
  ],
  "working": "#a3be8c",
  "waiting": "#d08770",
  "failed": "#bf616a",
  "scene": {
    "top": "#3b4252",
    "bottom": "#252a33",
    "glow": "#454e60",
    "plate": "#454e60",
    "grid": "#adb4c3",
    "edge": "#191d23"
  }
}
