{
  "$schema": "./schema.json",
  "version": 1,
  "id": "gothic-dark",
  "name": "Gothic dark",
  "family": "gothic",
  "familyName": "Gothic",
  "isDark": true,
  "background": "#141414",
  "surface": "#1f1f1f",
  "surfaceAlt": "#272727",
  "border": "#353535",
  "text": "#f2f2f2",
  "muted": "#8e8e8e",
  "accent": "#e0605a",
  "ansi": [
    "#1f1f1f",
    "#ff7a7a",
    "#7cc97f",
    "#e2c46d",
    "#7aaee8",
    "#d68ac0",
    "#6cc4cf",
    "#8e8e8e",
    "#353535",
    "#ff7a7a",
    "#7cc97f",
    "#e2c46d",
    "#7aaee8",
    "#d68ac0",
    "#6cc4cf",
    "#f2f2f2"
  ],
  "working": "#7cc97f",
  "waiting": "#eb9a5c",
  "failed": "#ff7a7a",
  "scene": {
    "top": "#1f1f1f",
    "bottom": "#101010",
    "glow": "#2c2c2c",
    "plate": "#2c2c2c",
    "grid": "#b3b3b3",
    "edge": "#0b0b0b"
  }
}
