{
  "$schema": "./schema.json",
  "version": 1,
  "id": "github-dark",
  "name": "GitHub Dark",
  "family": "github",
  "familyName": "GitHub",
  "isDark": true,
  "background": "#0d1117",
  "surface": "#161b22",
  "surfaceAlt": "#21262d",
  "border": "#30363d",
  "text": "#e6edf3",
  "muted": "#7d8590",
  "accent": "#4493f8",
  "selection": "#264f78",
  "ansi": [
    "#161b22",
    "#f85149",
    "#3fb950",
    "#d29922",
    "#58a6ff",
    "#db61a2",
    "#39c5cf",
    "#7d8590",
    "#30363d",
    "#f85149",
    "#3fb950",
    "#d29922",
    "#58a6ff",
    "#db61a2",
    "#39c5cf",
    "#e6edf3"
  ],
  "working": "#3fb950",
  "waiting": "#db6d28",
  "failed": "#f85149",
  "scene": {
    "top": "#161b22",
    "bottom": "#0a0e12",
    "glow": "#262b32",
    "plate": "#262b32",
    "grid": "#a4abb5",
    "edge": "#07090d"
  }
}
