{
  "$schema": "./schema.json",
  "version": 1,
  "id": "atom-one-dark",
  "name": "Atom One Dark",
  "isDark": true,
  "background": "#282c34",
  "surface": "#2f333b",
  "surfaceAlt": "#343841",
  "border": "#3d414a",
  "text": "#abb2bf",
  "muted": "#5c6370",
  "accent": "#61afef",
  "selection": "#3e4451",
  "ansi": [
    "#282c34",
    "#e06c75",
    "#98c379",
    "#e5c07b",
    "#61afef",
    "#c678dd",
    "#56b6c2",
    "#abb2bf",
    "#5c6370",
    "#e06c75",
    "#98c379",
    "#e5c07b",
    "#61afef",
    "#c678dd",
    "#56b6c2",
    "#ffffff"
  ],
  "scene": {
    "top": "#2f333b",
    "bottom": "#20232a",
    "glow": "#373b44",
    "plate": "#373b44",
    "grid": "#949ba9",
    "edge": "#16181d"
  },
  "credit": "Palette from the One Dark theme of the Atom editor (MIT)."
}
