{
  "$schema": "./schema.json",
  "version": 1,
  "id": "night-light",
  "name": "Night light",
  "family": "night",
  "familyName": "Night",
  "isDark": false,
  "background": "#f5f6f7",
  "surface": "#ffffff",
  "surfaceAlt": "#f0f2f4",
  "border": "#cfd4d9",
  "text": "#2e3033",
  "muted": "#6b7178",
  "accent": "#2f6fc4",
  "ansi": [
    "#2e3033",
    "#c4343f",
    "#2f7d32",
    "#8a6a00",
    "#2f6fc4",
    "#a03ca5",
    "#13788a",
    "#6b7178",
    "#cfd4d9",
    "#c4343f",
    "#2f7d32",
    "#8a6a00",
    "#2f6fc4",
    "#a03ca5",
    "#13788a",
    "#2e3033"
  ],
  "working": "#2f7d32",
  "waiting": "#b4561a",
  "failed": "#c4343f",
  "scene": {
    "top": "#fbfbfb",
    "bottom": "#dce0e4",
    "glow": "#fdfdfd",
    "plate": "#b2b6bb",
    "grid": "#878a8e",
    "edge": "#27292b",
    "xray": "#2f568a"
  }
}
