{
  "$schema": "./schema.json",
  "version": 1,
  "id": "whitey-dark",
  "name": "Whitey dark",
  "family": "whitey",
  "familyName": "Whitey",
  "isDark": true,
  "background": "#1d1e20",
  "surface": "#26272a",
  "surfaceAlt": "#2d2e31",
  "border": "#3c3d41",
  "text": "#ececec",
  "muted": "#9a9a9a",
  "accent": "#5aacdf",
  "ansi": [
    "#26272a",
    "#ef7b73",
    "#8cc98f",
    "#e2c46d",
    "#5aacdf",
    "#cf96c8",
    "#6fc5cf",
    "#9a9a9a",
    "#3c3d41",
    "#ef7b73",
    "#8cc98f",
    "#e2c46d",
    "#5aacdf",
    "#cf96c8",
    "#6fc5cf",
    "#ececec"
  ],
  "working": "#8cc98f",
  "waiting": "#e9a065",
  "failed": "#ef7b73",
  "scene": {
    "top": "#26272a",
    "bottom": "#17181a",
    "glow": "#333438",
    "plate": "#333438",
    "grid": "#b8b8b8",
    "edge": "#101012"
  }
}
