{
  "$schema": "./schema.json",
  "version": 1,
  "id": "gothic",
  "name": "Gothic",
  "family": "gothic",
  "familyName": "Gothic",
  "isDark": false,
  "background": "#fcfcfc",
  "surface": "#f3f3f3",
  "surfaceAlt": "#ececec",
  "border": "#dcdcdc",
  "text": "#111111",
  "muted": "#6f6f6f",
  "accent": "#990000",
  "ansi": [
    "#111111",
    "#c62828",
    "#2e7d32",
    "#8a6d00",
    "#1f5fa8",
    "#8e2470",
    "#0f6f7a",
    "#6f6f6f",
    "#dcdcdc",
    "#c62828",
    "#2e7d32",
    "#8a6d00",
    "#1f5fa8",
    "#8e2470",
    "#0f6f7a",
    "#111111"
  ],
  "working": "#2e7d32",
  "waiting": "#b35400",
  "failed": "#c62828",
  "scene": {
    "top": "#fefefe",
    "bottom": "#e2e2e2",
    "glow": "#fefefe",
    "plate": "#b7b7b7",
    "grid": "#818181",
    "edge": "#0e0e0e",
    "xray": "#630707"
  }
}
